{"authorization":"RESEARCH_ONLY_NOT_SHADOW_PAPER_OR_LIVE","discovery_contract":{"allocation_precedence":"DIRECT_EVIDENCE_READY_WORK_PREEMPTS","direct_evidence_ready":false,"excluded_strategy_families":["dra-entry-volume-confirmation-20d"],"maximum_preregistration_ideas":1,"outcome_access":"DENY","primary_sources":[{"doi":"10.1186/s40854-018-0119-8","publisher_url":"https://jfin-swufe.springeropen.com/articles/10.1186/s40854-018-0119-8","source_kind":"PRIMARY_RESEARCH_PUBLISHER_PAGE"},{"doi":"10.3390/risks13090168","publisher_url":"https://www.mdpi.com/2227-9091/13/9/168","source_kind":"PRIMARY_RESEARCH_PUBLISHER_PAGE"},{"doi":"10.3390/jrfm17100443","publisher_url":"https://www.mdpi.com/1911-8074/17/10/443","source_kind":"PRIMARY_RESEARCH_PUBLISHER_PAGE"}],"prior_accepted_output_ids":["output-dra-volume-preregistration-discovery-v1"],"research_mode":"PUBLIC_PRIMARY_SOURCE_PREREGISTRATION_DISCOVERY","result_boundary":"ONE_PREREGISTRATION_READY_IDEA_OR_CLOSE","runner_execution":"DENY","strategy_family":"btc-search-attention-volume-interaction"},"dispatch_id":"manager-btc-search-attention-volume-preregistration-v2","dispatch_sha256":"9b43a6c299ade4e1cee9c8c24c700d1f85bbc9c412497204eab6d3aca0c5b29c","document_type":"LOCAL_PREREGISTRATION_DISCOVERY_V2","duplicate_family_key":"research-factory-preregistration-discovery-v1","exception_id":"preregistration-discovery-btc-search-attention-volume-v2","intent_id":"intent-btc-search-attention-volume-preregistration-v2","intent_sha256":"7fd1a518d3ba0cdeed4200cdf0ad6e049da31f7b949f4a25ca8f77eb7c35929a","issued_at":"2026-08-17T03:44:45Z","output_class":"SPEC_OR_CAPABILITY_SLICE","rolling_budget":{"days":7,"maximum_accepted_uses":2},"safety_boundaries":{"adds_timer":false,"creates_candidate":false,"creates_hypothesis":false,"creates_strategy_result":false,"opens_oos":false,"runs_backtest":false,"trading_action":false,"uses_paid_api":false,"writes_canonical_state":false},"schema_version":"2","state_authority":"SERVER_CANONICAL","task_id":"local-node-btc-search-attention-volume-preregistration-v2","task_sha256":"cf267949f86cecdfab7d02bf98b041131f43edf749439fa0bb4582367f1cc9fb","timer_authority":"CODEX_CLOUD_OPS_ONLY"}
